{
  "script_version": "story-script-v1",
  "script_id": "story.script.qc02.shift12",
  "chapter_id": "story.shift.qc02.12",
  "statements": [
    {
      "type": "label",
      "label_id": "story.qc02.shift12.entry"
    },
    {
      "type": "scene",
      "scene_id": "story.scene.qc02.shift12.entry",
      "background_asset_id": "story.bg.trinity.trace.night",
      "location_text_id": "text.qc01.location.trace",
      "time_text_id": "text.qc01.time.late_shift",
      "transition": "DISSOLVE",
      "checkpoint_id": "checkpoint.qc02.shift12.entry"
    },
    {
      "type": "hide",
      "tag": "cast.sora",
      "layer": "characters",
      "transition": "CUT"
    },
    {
      "type": "hide",
      "tag": "cast.malik",
      "layer": "characters",
      "transition": "CUT"
    },
    {
      "type": "hide",
      "tag": "cast.hana",
      "layer": "characters",
      "transition": "CUT"
    },
    {
      "type": "hide",
      "tag": "cast.jonah",
      "layer": "characters",
      "transition": "CUT"
    },
    {
      "type": "show",
      "tag": "cast.jonah",
      "layer": "characters",
      "character_id": "story.character.jonah_reed",
      "pose_id": "thoughtful",
      "position": "LEFT",
      "transition": "FADE"
    },
    {
      "type": "show",
      "tag": "cast.sora",
      "layer": "characters",
      "character_id": "story.character.sora_chen",
      "pose_id": "focused",
      "position": "RIGHT",
      "transition": "FADE"
    },
    {
      "type": "narrate",
      "statement_id": "story.qc02.s12.entry.01",
      "text_id": "text.qc02.s12.entry.01",
      "style_key": "NARRATION"
    },
    {
      "type": "say",
      "statement_id": "story.qc02.s12.entry.02",
      "speaker_key": "story.character.jonah_reed",
      "text_id": "text.qc02.s12.entry.02",
      "style_key": "DIALOGUE"
    },
    {
      "type": "say",
      "statement_id": "story.qc02.s12.entry.03",
      "speaker_key": "story.character.sora_chen",
      "text_id": "text.qc02.s12.entry.03",
      "style_key": "DIALOGUE"
    },
    {
      "type": "say",
      "statement_id": "story.qc02.s12.entry.04",
      "speaker_key": "story.character.jonah_reed",
      "text_id": "text.qc02.s12.entry.04",
      "style_key": "DIALOGUE"
    },
    {
      "type": "say",
      "statement_id": "story.qc02.s12.entry.05",
      "speaker_key": "story.character.sora_chen",
      "text_id": "text.qc02.s12.entry.05",
      "style_key": "DIALOGUE"
    },
    {
      "type": "label",
      "label_id": "story.qc02.shift12.match"
    },
    {
      "type": "say",
      "statement_id": "story.qc02.s12.match.01",
      "speaker_key": "story.character.sora_chen",
      "text_id": "text.qc02.s12.match.01",
      "style_key": "DIALOGUE"
    },
    {
      "type": "start_match",
      "match_ref": "story.match.qc02.shift12.bmc_recovery",
      "return_label": "story.qc02.shift12.return",
      "pre_match_checkpoint_id": "checkpoint.qc02.shift12.pre_match",
      "post_match_checkpoint_id": "checkpoint.qc02.shift12.post_match"
    },
    {
      "type": "label",
      "label_id": "story.qc02.shift12.return"
    },
    {
      "type": "if",
      "condition": {
        "op": "MATCH_RESULT",
        "match_ref": "story.match.qc02.shift12.bmc_recovery",
        "field": "completion",
        "comparator": "EQUALS",
        "value": "COMPLETED"
      },
      "then_label": "story.qc02.shift12.success",
      "else_label": "story.qc02.shift12.abandon"
    },
    {
      "type": "label",
      "label_id": "story.qc02.shift12.success"
    },
    {
      "type": "scene",
      "scene_id": "story.scene.qc02.shift12.success",
      "background_asset_id": "story.bg.trinity.validation_gate.predawn",
      "location_text_id": "text.qc01.location.gate",
      "time_text_id": "text.qc01.time.predawn",
      "transition": "DISSOLVE"
    },
    {
      "type": "hide",
      "tag": "cast.sora",
      "layer": "characters",
      "transition": "CUT"
    },
    {
      "type": "hide",
      "tag": "cast.malik",
      "layer": "characters",
      "transition": "CUT"
    },
    {
      "type": "hide",
      "tag": "cast.hana",
      "layer": "characters",
      "transition": "CUT"
    },
    {
      "type": "hide",
      "tag": "cast.jonah",
      "layer": "characters",
      "transition": "CUT"
    },
    {
      "type": "show",
      "tag": "cast.jonah",
      "layer": "characters",
      "character_id": "story.character.jonah_reed",
      "pose_id": "thoughtful",
      "position": "LEFT",
      "transition": "FADE"
    },
    {
      "type": "show",
      "tag": "cast.hana",
      "layer": "characters",
      "character_id": "story.character.hana_park",
      "pose_id": "relief",
      "position": "RIGHT",
      "transition": "FADE"
    },
    {
      "type": "say",
      "statement_id": "story.qc02.s12.success.01",
      "speaker_key": "story.character.hana_park",
      "text_id": "text.qc02.s12.success.01",
      "style_key": "DIALOGUE"
    },
    {
      "type": "say",
      "statement_id": "story.qc02.s12.success.02",
      "speaker_key": "story.character.jonah_reed",
      "text_id": "text.qc02.s12.success.02",
      "style_key": "DIALOGUE"
    },
    {
      "type": "jump",
      "label_id": "story.qc02.shift12.follow_on"
    },
    {
      "type": "label",
      "label_id": "story.qc02.shift12.abandon"
    },
    {
      "type": "scene",
      "scene_id": "story.scene.qc02.shift12.abandon",
      "background_asset_id": "story.bg.trinity.validation_gate.predawn",
      "location_text_id": "text.qc01.location.gate",
      "time_text_id": "text.qc01.time.predawn",
      "transition": "DISSOLVE"
    },
    {
      "type": "hide",
      "tag": "cast.sora",
      "layer": "characters",
      "transition": "CUT"
    },
    {
      "type": "hide",
      "tag": "cast.malik",
      "layer": "characters",
      "transition": "CUT"
    },
    {
      "type": "hide",
      "tag": "cast.hana",
      "layer": "characters",
      "transition": "CUT"
    },
    {
      "type": "hide",
      "tag": "cast.jonah",
      "layer": "characters",
      "transition": "CUT"
    },
    {
      "type": "show",
      "tag": "cast.jonah",
      "layer": "characters",
      "character_id": "story.character.jonah_reed",
      "pose_id": "thoughtful",
      "position": "LEFT",
      "transition": "FADE"
    },
    {
      "type": "show",
      "tag": "cast.hana",
      "layer": "characters",
      "character_id": "story.character.hana_park",
      "pose_id": "skeptical",
      "position": "RIGHT",
      "transition": "FADE"
    },
    {
      "type": "say",
      "statement_id": "story.qc02.s12.abandon.01",
      "speaker_key": "story.character.hana_park",
      "text_id": "text.qc02.s12.abandon.01",
      "style_key": "DIALOGUE"
    },
    {
      "type": "say",
      "statement_id": "story.qc02.s12.abandon.02",
      "speaker_key": "story.character.jonah_reed",
      "text_id": "text.qc02.s12.abandon.02",
      "style_key": "DIALOGUE"
    },
    {
      "type": "jump",
      "label_id": "story.qc02.shift12.follow_on"
    },
    {
      "type": "label",
      "label_id": "story.qc02.shift12.follow_on"
    },
    {
      "type": "scene",
      "scene_id": "story.scene.qc02.shift12.follow_on",
      "background_asset_id": "story.bg.trinity.validation_gate.predawn",
      "location_text_id": "text.qc01.location.gate",
      "time_text_id": "text.qc01.time.predawn",
      "transition": "DISSOLVE"
    },
    {
      "type": "hide",
      "tag": "cast.sora",
      "layer": "characters",
      "transition": "CUT"
    },
    {
      "type": "hide",
      "tag": "cast.malik",
      "layer": "characters",
      "transition": "CUT"
    },
    {
      "type": "hide",
      "tag": "cast.hana",
      "layer": "characters",
      "transition": "CUT"
    },
    {
      "type": "hide",
      "tag": "cast.jonah",
      "layer": "characters",
      "transition": "CUT"
    },
    {
      "type": "show",
      "tag": "cast.hana",
      "layer": "characters",
      "character_id": "story.character.hana_park",
      "pose_id": "relief",
      "position": "RIGHT",
      "transition": "FADE"
    },
    {
      "type": "show",
      "tag": "cast.sora",
      "layer": "characters",
      "character_id": "story.character.sora_chen",
      "pose_id": "approving",
      "position": "LEFT",
      "transition": "FADE"
    },
    {
      "type": "say",
      "statement_id": "story.qc02.s12.follow.01",
      "speaker_key": "story.character.hana_park",
      "text_id": "text.qc02.s12.follow.01",
      "style_key": "DIALOGUE"
    },
    {
      "type": "say",
      "statement_id": "story.qc02.s12.follow.02",
      "speaker_key": "story.character.sora_chen",
      "text_id": "text.qc02.s12.follow.02",
      "style_key": "DIALOGUE"
    },
    {
      "type": "jump",
      "label_id": "story.qc02.ending.current_content"
    },
    {
      "type": "label",
      "label_id": "story.qc02.ending.current_content"
    },
    {
      "type": "end",
      "ending_id": "ending.qc02.current_content",
      "checkpoint_id": "checkpoint.qc02.ending.current_content"
    }
  ]
}
