{
  "script_version": "story-script-v1",
  "script_id": "story.script.qc02.shift11",
  "chapter_id": "story.shift.qc02.11",
  "statements": [
    {
      "type": "label",
      "label_id": "story.qc02.shift11.entry"
    },
    {
      "type": "scene",
      "scene_id": "story.scene.qc02.shift11.entry",
      "background_asset_id": "story.bg.trinity.core_floor.night_storm",
      "location_text_id": "text.qc01.location.core_floor",
      "time_text_id": "text.qc01.time.late_shift",
      "transition": "DISSOLVE",
      "checkpoint_id": "checkpoint.qc02.shift11.entry"
    },
    {
      "type": "hide",
      "tag": "cast.sora",
      "layer": "characters",
      "transition": "CUT"
    },
    {
      "type": "hide",
      "tag": "cast.malik",
      "layer": "characters",
      "transition": "CUT"
    },
    {
      "type": "hide",
      "tag": "cast.hana",
      "layer": "characters",
      "transition": "CUT"
    },
    {
      "type": "hide",
      "tag": "cast.jonah",
      "layer": "characters",
      "transition": "CUT"
    },
    {
      "type": "show",
      "tag": "cast.malik",
      "layer": "characters",
      "character_id": "story.character.malik_okoye",
      "pose_id": "defensive",
      "position": "LEFT",
      "transition": "FADE"
    },
    {
      "type": "show",
      "tag": "cast.sora",
      "layer": "characters",
      "character_id": "story.character.sora_chen",
      "pose_id": "focused",
      "position": "RIGHT",
      "transition": "FADE"
    },
    {
      "type": "narrate",
      "statement_id": "story.qc02.s11.entry.01",
      "text_id": "text.qc02.s11.entry.01",
      "style_key": "NARRATION"
    },
    {
      "type": "say",
      "statement_id": "story.qc02.s11.entry.02",
      "speaker_key": "story.character.malik_okoye",
      "text_id": "text.qc02.s11.entry.02",
      "style_key": "DIALOGUE"
    },
    {
      "type": "say",
      "statement_id": "story.qc02.s11.entry.03",
      "speaker_key": "story.character.sora_chen",
      "text_id": "text.qc02.s11.entry.03",
      "style_key": "DIALOGUE"
    },
    {
      "type": "say",
      "statement_id": "story.qc02.s11.entry.04",
      "speaker_key": "story.character.malik_okoye",
      "text_id": "text.qc02.s11.entry.04",
      "style_key": "DIALOGUE"
    },
    {
      "type": "label",
      "label_id": "story.qc02.shift11.match"
    },
    {
      "type": "say",
      "statement_id": "story.qc02.s11.match.01",
      "speaker_key": "story.character.sora_chen",
      "text_id": "text.qc02.s11.match.01",
      "style_key": "DIALOGUE"
    },
    {
      "type": "start_match",
      "match_ref": "story.match.qc02.shift11.firmware_regression",
      "return_label": "story.qc02.shift11.return",
      "pre_match_checkpoint_id": "checkpoint.qc02.shift11.pre_match",
      "post_match_checkpoint_id": "checkpoint.qc02.shift11.post_match"
    },
    {
      "type": "label",
      "label_id": "story.qc02.shift11.return"
    },
    {
      "type": "if",
      "condition": {
        "op": "MATCH_RESULT",
        "match_ref": "story.match.qc02.shift11.firmware_regression",
        "field": "completion",
        "comparator": "EQUALS",
        "value": "COMPLETED"
      },
      "then_label": "story.qc02.shift11.success",
      "else_label": "story.qc02.shift11.abandon"
    },
    {
      "type": "label",
      "label_id": "story.qc02.shift11.success"
    },
    {
      "type": "scene",
      "scene_id": "story.scene.qc02.shift11.success",
      "background_asset_id": "story.bg.trinity.trace.night",
      "location_text_id": "text.qc01.location.trace",
      "time_text_id": "text.qc01.time.late_shift",
      "transition": "DISSOLVE"
    },
    {
      "type": "hide",
      "tag": "cast.sora",
      "layer": "characters",
      "transition": "CUT"
    },
    {
      "type": "hide",
      "tag": "cast.malik",
      "layer": "characters",
      "transition": "CUT"
    },
    {
      "type": "hide",
      "tag": "cast.hana",
      "layer": "characters",
      "transition": "CUT"
    },
    {
      "type": "hide",
      "tag": "cast.jonah",
      "layer": "characters",
      "transition": "CUT"
    },
    {
      "type": "show",
      "tag": "cast.malik",
      "layer": "characters",
      "character_id": "story.character.malik_okoye",
      "pose_id": "focused",
      "position": "LEFT",
      "transition": "FADE"
    },
    {
      "type": "show",
      "tag": "cast.sora",
      "layer": "characters",
      "character_id": "story.character.sora_chen",
      "pose_id": "approving",
      "position": "RIGHT",
      "transition": "FADE"
    },
    {
      "type": "say",
      "statement_id": "story.qc02.s11.success.01",
      "speaker_key": "story.character.sora_chen",
      "text_id": "text.qc02.s11.success.01",
      "style_key": "DIALOGUE"
    },
    {
      "type": "say",
      "statement_id": "story.qc02.s11.success.02",
      "speaker_key": "story.character.malik_okoye",
      "text_id": "text.qc02.s11.success.02",
      "style_key": "DIALOGUE"
    },
    {
      "type": "jump",
      "label_id": "story.qc02.shift11.follow_on"
    },
    {
      "type": "label",
      "label_id": "story.qc02.shift11.abandon"
    },
    {
      "type": "scene",
      "scene_id": "story.scene.qc02.shift11.abandon",
      "background_asset_id": "story.bg.trinity.trace.night",
      "location_text_id": "text.qc01.location.trace",
      "time_text_id": "text.qc01.time.late_shift",
      "transition": "DISSOLVE"
    },
    {
      "type": "hide",
      "tag": "cast.sora",
      "layer": "characters",
      "transition": "CUT"
    },
    {
      "type": "hide",
      "tag": "cast.malik",
      "layer": "characters",
      "transition": "CUT"
    },
    {
      "type": "hide",
      "tag": "cast.hana",
      "layer": "characters",
      "transition": "CUT"
    },
    {
      "type": "hide",
      "tag": "cast.jonah",
      "layer": "characters",
      "transition": "CUT"
    },
    {
      "type": "show",
      "tag": "cast.malik",
      "layer": "characters",
      "character_id": "story.character.malik_okoye",
      "pose_id": "focused",
      "position": "LEFT",
      "transition": "FADE"
    },
    {
      "type": "show",
      "tag": "cast.sora",
      "layer": "characters",
      "character_id": "story.character.sora_chen",
      "pose_id": "focused",
      "position": "RIGHT",
      "transition": "FADE"
    },
    {
      "type": "say",
      "statement_id": "story.qc02.s11.abandon.01",
      "speaker_key": "story.character.sora_chen",
      "text_id": "text.qc02.s11.abandon.01",
      "style_key": "DIALOGUE"
    },
    {
      "type": "say",
      "statement_id": "story.qc02.s11.abandon.02",
      "speaker_key": "story.character.malik_okoye",
      "text_id": "text.qc02.s11.abandon.02",
      "style_key": "DIALOGUE"
    },
    {
      "type": "jump",
      "label_id": "story.qc02.shift11.follow_on"
    },
    {
      "type": "label",
      "label_id": "story.qc02.shift11.follow_on"
    },
    {
      "type": "scene",
      "scene_id": "story.scene.qc02.shift11.follow_on",
      "background_asset_id": "story.bg.trinity.trace.night",
      "location_text_id": "text.qc01.location.trace",
      "time_text_id": "text.qc01.time.late_shift",
      "transition": "DISSOLVE"
    },
    {
      "type": "hide",
      "tag": "cast.sora",
      "layer": "characters",
      "transition": "CUT"
    },
    {
      "type": "hide",
      "tag": "cast.malik",
      "layer": "characters",
      "transition": "CUT"
    },
    {
      "type": "hide",
      "tag": "cast.hana",
      "layer": "characters",
      "transition": "CUT"
    },
    {
      "type": "hide",
      "tag": "cast.jonah",
      "layer": "characters",
      "transition": "CUT"
    },
    {
      "type": "show",
      "tag": "cast.sora",
      "layer": "characters",
      "character_id": "story.character.sora_chen",
      "pose_id": "focused",
      "position": "RIGHT",
      "transition": "FADE"
    },
    {
      "type": "show",
      "tag": "cast.malik",
      "layer": "characters",
      "character_id": "story.character.malik_okoye",
      "pose_id": "focused",
      "position": "LEFT",
      "transition": "FADE"
    },
    {
      "type": "say",
      "statement_id": "story.qc02.s11.follow.01",
      "speaker_key": "story.character.sora_chen",
      "text_id": "text.qc02.s11.follow.01",
      "style_key": "DIALOGUE"
    },
    {
      "type": "if",
      "condition": {
        "op": "VARIABLE_EQUALS",
        "variable_id": "story.qc02.change_evidence_frame",
        "value": "CURRENT_STATE_FIRST"
      },
      "then_label": "story.qc02.shift11.change_frame_ack.current_state_first",
      "else_label": "story.qc02.shift11.change_frame_ack.change_history_first"
    },
    {
      "type": "label",
      "label_id": "story.qc02.shift11.change_frame_ack.current_state_first"
    },
    {
      "type": "say",
      "statement_id": "story.qc02.s11.ack.change.current.01",
      "speaker_key": "story.character.sora_chen",
      "text_id": "text.qc02.s11.ack.change.current.01",
      "style_key": "DIALOGUE"
    },
    {
      "type": "jump",
      "label_id": "story.qc02.shift11.change_frame_ack"
    },
    {
      "type": "label",
      "label_id": "story.qc02.shift11.change_frame_ack.change_history_first"
    },
    {
      "type": "say",
      "statement_id": "story.qc02.s11.ack.change.history.01",
      "speaker_key": "story.character.sora_chen",
      "text_id": "text.qc02.s11.ack.change.history.01",
      "style_key": "DIALOGUE"
    },
    {
      "type": "jump",
      "label_id": "story.qc02.shift11.change_frame_ack"
    },
    {
      "type": "label",
      "label_id": "story.qc02.shift11.change_frame_ack"
    },
    {
      "type": "jump",
      "label_id": "story.qc02.shift12.entry"
    }
  ]
}
