{
  "script_version": "story-script-v1",
  "script_id": "story.script.qc01.chapter03",
  "chapter_id": "story.chapter.qc01.read_worklogs",
  "statements": [
    { "type": "label", "label_id": "story.qc01.act03.entry" },
    { "type": "scene", "scene_id": "story.scene.qc01.act03.knowledge", "background_asset_id": "story.bg.trinity.knowledge_systems.night", "location_text_id": "text.qc01.location.knowledge", "time_text_id": "text.qc01.time.late_shift", "transition": "DISSOLVE", "checkpoint_id": "checkpoint.qc01.chapter03.entry" },
    { "type": "hide", "tag": "cast.ev", "layer": "characters", "transition": "CUT" },
    { "type": "hide", "tag": "cast.malik", "layer": "characters", "transition": "CUT" },
    { "type": "hide", "tag": "cast.sora", "layer": "characters", "transition": "CUT" },
    { "type": "show", "tag": "cast.jonah", "layer": "characters", "character_id": "story.character.jonah_reed", "pose_id": "defensive", "position": "LEFT", "transition": "FADE" },
    { "type": "show", "tag": "cast.hana", "layer": "characters", "character_id": "story.character.hana_park", "pose_id": "skeptical", "position": "RIGHT", "transition": "FADE" },
    { "type": "narrate", "statement_id": "story.qc01.ch03.entry.01", "text_id": "text.qc01.ch03.entry.01", "style_key": "NARRATION" },
    { "type": "say", "statement_id": "story.qc01.ch03.entry.02", "speaker_key": "story.character.jonah_reed", "text_id": "text.qc01.ch03.entry.02", "style_key": "DIALOGUE" },
    { "type": "show", "tag": "insert.sift_gap", "layer": "transient", "asset_id": "story.insert.qc01.sift_provenance_gap", "position": "CENTER", "transition": "FADE" },
    { "type": "say", "statement_id": "story.qc01.ch03.entry.03", "speaker_key": "story.character.hana_park", "text_id": "text.qc01.ch03.entry.03", "style_key": "DIALOGUE" },
    {
      "type": "choice",
      "choice_id": "choice.qc01.record_policy",
      "prompt_text_id": "text.qc01.ch03.choice.record.prompt",
      "options": [
        { "option_id": "preserve_negative_results", "text_id": "text.qc01.ch03.choice.record.negatives", "jump_label": "story.qc01.act03.preserve_route", "writes": [{ "variable_id": "story.qc01.record_policy", "value": "PRESERVE_NEGATIVE_RESULTS" }] },
        { "option_id": "lead_with_summary", "text_id": "text.qc01.ch03.choice.record.summary", "jump_label": "story.qc01.act03.summary_route", "writes": [{ "variable_id": "story.qc01.record_policy", "value": "LEAD_WITH_SUMMARY" }] }
      ]
    },

    { "type": "label", "label_id": "story.qc01.act03.preserve_route" },
    { "type": "show", "tag": "cast.jonah", "layer": "characters", "character_id": "story.character.jonah_reed", "pose_id": "thoughtful", "position": "LEFT", "transition": "FADE" },
    { "type": "say", "statement_id": "story.qc01.ch03.preserve.01", "speaker_key": "story.character.jonah_reed", "text_id": "text.qc01.ch03.preserve.01", "style_key": "DIALOGUE" },
    { "type": "say", "statement_id": "story.qc01.ch03.preserve.02", "speaker_key": "story.character.hana_park", "text_id": "text.qc01.ch03.preserve.02", "style_key": "DIALOGUE" },
    { "type": "jump", "label_id": "story.qc01.act03.converge" },

    { "type": "label", "label_id": "story.qc01.act03.summary_route" },
    { "type": "show", "tag": "cast.jonah", "layer": "characters", "character_id": "story.character.jonah_reed", "pose_id": "defensive", "position": "LEFT", "transition": "FADE" },
    { "type": "say", "statement_id": "story.qc01.ch03.summary.01", "speaker_key": "story.character.jonah_reed", "text_id": "text.qc01.ch03.summary.01", "style_key": "DIALOGUE" },
    { "type": "say", "statement_id": "story.qc01.ch03.summary.02", "speaker_key": "story.character.hana_park", "text_id": "text.qc01.ch03.summary.02", "style_key": "DIALOGUE" },
    { "type": "jump", "label_id": "story.qc01.act03.converge" },

    { "type": "label", "label_id": "story.qc01.act03.converge" },
    { "type": "hide", "tag": "insert.sift_gap", "layer": "transient", "transition": "FADE" },
    { "type": "say", "statement_id": "story.qc01.ch03.converge.01", "speaker_key": "story.character.hana_park", "text_id": "text.qc01.ch03.converge.01", "style_key": "DIALOGUE" },
    { "type": "jump", "label_id": "story.qc01.shift05.match" },

    { "type": "label", "label_id": "story.qc01.shift05.match" },
    { "type": "scene", "scene_id": "story.scene.qc01.shift05.network", "background_asset_id": "story.bg.trinity.core_floor.night_storm", "location_text_id": "text.qc01.location.core_floor", "time_text_id": "text.qc01.time.late_shift", "transition": "DISSOLVE", "checkpoint_id": "checkpoint.qc01.shift05.scene" },
    { "type": "hide", "tag": "cast.hana", "layer": "characters", "transition": "CUT" },
    { "type": "show", "tag": "cast.jonah", "layer": "characters", "character_id": "story.character.jonah_reed", "pose_id": "thoughtful", "position": "LEFT", "transition": "FADE" },
    { "type": "say", "statement_id": "story.qc01.ch03.shift05.01", "speaker_key": "story.character.jonah_reed", "text_id": "text.qc01.ch03.shift05.01", "style_key": "DIALOGUE" },
    { "type": "say", "statement_id": "story.qc01.ch03.shift05.02", "speaker_key": "story.character.jonah_reed", "text_id": "text.qc01.ch03.shift05.02", "style_key": "DIALOGUE" },
    { "type": "start_match", "match_ref": "story.match.qc01.shift05.no_offer", "return_label": "story.qc01.shift05.return", "pre_match_checkpoint_id": "checkpoint.qc01.shift05.pre_match", "post_match_checkpoint_id": "checkpoint.qc01.shift05.post_match" },

    { "type": "label", "label_id": "story.qc01.shift05.return" },
    { "type": "if", "condition": { "op": "MATCH_RESULT", "match_ref": "story.match.qc01.shift05.no_offer", "field": "completion", "comparator": "EQUALS", "value": "COMPLETED" }, "then_label": "story.qc01.shift05.success", "else_label": "story.qc01.shift05.abandon" },

    { "type": "label", "label_id": "story.qc01.shift05.success" },
    { "type": "scene", "scene_id": "story.scene.qc01.shift05.knowledge_success", "background_asset_id": "story.bg.trinity.knowledge_systems.night", "location_text_id": "text.qc01.location.knowledge", "time_text_id": "text.qc01.time.late_shift", "transition": "DISSOLVE" },
    { "type": "show", "tag": "cast.jonah", "layer": "characters", "character_id": "story.character.jonah_reed", "pose_id": "thoughtful", "position": "LEFT", "transition": "FADE" },
    { "type": "show", "tag": "cast.hana", "layer": "characters", "character_id": "story.character.hana_park", "pose_id": "relief", "position": "RIGHT", "transition": "FADE" },
    { "type": "say", "statement_id": "story.qc01.ch03.shift05.success.01", "speaker_key": "story.character.jonah_reed", "text_id": "text.qc01.ch03.shift05.success.01", "style_key": "DIALOGUE" },
    { "type": "say", "statement_id": "story.qc01.ch03.shift05.success.02", "speaker_key": "story.character.hana_park", "text_id": "text.qc01.ch03.shift05.success.02", "style_key": "DIALOGUE" },
    { "type": "jump", "label_id": "story.qc01.act03.record_ack" },

    { "type": "label", "label_id": "story.qc01.shift05.abandon" },
    { "type": "scene", "scene_id": "story.scene.qc01.shift05.knowledge_abandon", "background_asset_id": "story.bg.trinity.knowledge_systems.night", "location_text_id": "text.qc01.location.knowledge", "time_text_id": "text.qc01.time.late_shift", "transition": "DISSOLVE" },
    { "type": "show", "tag": "cast.jonah", "layer": "characters", "character_id": "story.character.jonah_reed", "pose_id": "defensive", "position": "LEFT", "transition": "FADE" },
    { "type": "show", "tag": "cast.hana", "layer": "characters", "character_id": "story.character.hana_park", "pose_id": "skeptical", "position": "RIGHT", "transition": "FADE" },
    { "type": "say", "statement_id": "story.qc01.ch03.shift05.abandon.01", "speaker_key": "story.character.jonah_reed", "text_id": "text.qc01.ch03.shift05.abandon.01", "style_key": "DIALOGUE" },
    { "type": "say", "statement_id": "story.qc01.ch03.shift05.abandon.02", "speaker_key": "story.character.hana_park", "text_id": "text.qc01.ch03.shift05.abandon.02", "style_key": "DIALOGUE" },
    { "type": "jump", "label_id": "story.qc01.act03.record_ack" },

    { "type": "label", "label_id": "story.qc01.act03.record_ack" },
    { "type": "if", "condition": { "op": "CHOICE_IS", "choice_id": "choice.qc01.record_policy", "option_id": "preserve_negative_results" }, "then_label": "story.qc01.act03.negatives_ack", "else_label": "story.qc01.act03.summary_ack" },

    { "type": "label", "label_id": "story.qc01.act03.negatives_ack" },
    { "type": "say", "statement_id": "story.qc01.ch03.ack.negatives.01", "speaker_key": "story.character.jonah_reed", "text_id": "text.qc01.ch03.ack.negatives.01", "style_key": "DIALOGUE" },
    { "type": "jump", "label_id": "story.qc01.act03.debrief" },

    { "type": "label", "label_id": "story.qc01.act03.summary_ack" },
    { "type": "say", "statement_id": "story.qc01.ch03.ack.summary.01", "speaker_key": "story.character.hana_park", "text_id": "text.qc01.ch03.ack.summary.01", "style_key": "DIALOGUE" },
    { "type": "jump", "label_id": "story.qc01.act03.debrief" },

    { "type": "label", "label_id": "story.qc01.act03.debrief" },
    { "type": "show", "tag": "insert.sift_gap", "layer": "transient", "asset_id": "story.insert.qc01.sift_provenance_gap", "position": "CENTER", "transition": "FADE" },
    { "type": "say", "statement_id": "story.qc01.ch03.debrief.01", "speaker_key": "story.character.jonah_reed", "text_id": "text.qc01.ch03.debrief.01", "style_key": "DIALOGUE" },
    { "type": "say", "statement_id": "story.qc01.ch03.debrief.02", "speaker_key": "story.character.hana_park", "text_id": "text.qc01.ch03.debrief.02", "style_key": "DIALOGUE" },
    { "type": "jump", "label_id": "story.qc01.act04.entry" }
  ]
}
